{
  "$schema": "https://json-schema.org/draft/2020-12/schema",
  "$id": "https://ironwright.dev/schemas/registrar/agr.schema.json",
  "title": "ArtifactGenerationRequest",
  "description": "Contract between the Governor (Copilot declarative agent) and Generation Engine v2. Domains follow Arti-Generator spec Section 10. Deliberately strict: closed enums, no additionalProperties, exact patterns. Governor drift must surface as SchemaValidationError, never as silent acceptance. Schema-valid does not mean generation-valid: registry sync, lifecycle transition legality, clause hashes, and placeholder resolution are enforced by the engine's semantic validation layers after schema validation passes.",
  "type": "object",
  "additionalProperties": false,
  "required": ["schemaVersion", "artifactIdentity", "context", "sourceWorkflowContext", "dataInputs", "renderingOptions", "validationPolicy"],
  "properties": {

    "schemaVersion": {
      "type": "string",
      "const": "1.0.0",
      "description": "AGR contract version. The engine rejects mismatches (ConfigurationError) rather than best-effort parsing."
    },

    "artifactIdentity": {
      "type": "object",
      "additionalProperties": false,
      "required": ["artifactType", "documentId", "version", "classification", "approvalStatus", "layer"],
      "properties": {
        "artifactType": {
          "type": "string",
          "enum": ["DS", "AUP", "UQR", "TCL", "TAK", "TVR", "RAF", "ERL", "DCN", "SOP", "RBK", "DQR", "ONB", "OFB", "LIC", "PIG", "QAC", "PMC", "AAT", "SPEC", "UG", "WFE", "SCL", "PDX"]
        },
        "documentId": {
          "type": "string",
          "pattern": "^ORG-(GOV-(DS|AUP)|TRN-(TCL|TAK|TVR)|RSK-(RAF|ERL)|OPS-(UQR|DCN|SOP|RBK|DQR|ONB|OFB|LIC)|INT-(PIG|QAC|PMC|AAT)|MST-(SPEC|UG|WFE|SCL|PDX))-[0-9]{3}$",
          "description": "Must already be issued by the ID Registrar and present in the ID Registry in Draft status. The engine verifies registry state (RegistrySyncError on mismatch); it never mints IDs. Pattern encodes valid category/code pairings; engine additionally verifies the embedded code matches artifactType."
        },
        "version": { "type": "string", "pattern": "^v[0-9]+\\.[0-9]+$" },
        "classification": {
          "type": "string",
          "enum": ["Client-Facing", "Controlled Signoff", "Internal Working Document"]
        },
        "approvalStatus": {
          "type": "string",
          "enum": ["Draft", "In Review", "Approved", "Superseded", "Retired"],
          "description": "Status this generation targets. New artifacts must be Draft. Any transition is validated against vocabularies.json transitions and current registry state (LifecycleTransitionError)."
        },
        "layer": {
          "type": "string",
          "enum": ["Governance", "Operational", "Delivery", "Administration"]
        }
      }
    },

    "context": {
      "type": "object",
      "additionalProperties": false,
      "required": ["owner", "audience", "preparedBy"],
      "properties": {
        "client": { "type": ["string", "null"], "minLength": 1, "description": "Null only for MST and internal-only artifacts (client-scoping rule, Spec 5.5)." },
        "engagement": { "type": ["string", "null"], "minLength": 1 },
        "owner": { "type": "string", "minLength": 1, "description": "Accountable role or team, typically Registry Owner." },
        "audience": { "type": "string", "minLength": 1, "description": "Plain-English intended reader. Client context lives here and in the filename, never in the Document ID." },
        "preparedBy": { "type": "string", "minLength": 1, "default": "ORG Consulting, LLC" },
        "reviewDate": {
          "type": ["string", "null"],
          "pattern": "^[0-9]{4}-[0-9]{2}-[0-9]{2}$",
          "description": "ISO 8601. Null permitted in Draft ('to be set on Approved'). Required at promotion. Must be at or before the category default interval unless reviewDateOverride is present."
        },
        "reviewDateOverride": {
          "type": ["object", "null"],
          "additionalProperties": false,
          "required": ["approvedBy", "approvalDate", "justification"],
          "properties": {
            "approvedBy": { "type": "string", "minLength": 1, "description": "Documentation owner sign-off is required for any interval longer than the category default (Spec 5.6)." },
            "approvalDate": { "type": "string", "pattern": "^[0-9]{4}-[0-9]{2}-[0-9]{2}$" },
            "justification": { "type": "string", "minLength": 1 }
          }
        }
      }
    },

    "sourceWorkflowContext": {
      "type": "object",
      "additionalProperties": false,
      "required": ["workflowName", "phase", "executionId"],
      "properties": {
        "workflowName": { "type": "string", "minLength": 1 },
        "phase": { "type": "string", "minLength": 1 },
        "executionId": { "type": "string", "minLength": 1, "description": "Correlates the generated artifact, its logs, and its validation report back to the Governor session. Operator-assigned if the Governor cannot mint one." }
      }
    },

    "dataInputs": {
      "type": "object",
      "additionalProperties": false,
      "required": ["placeholderMap", "sections"],
      "properties": {
        "placeholderMap": {
          "type": "object",
          "description": "Canonical token to resolved value. Keys must match the placeholder token pattern and, for known tokens, the canonical form in placeholder-dictionary.json. Values of null mean intentionally-retained-for-client-completion (permitted in Draft only for Client-Facing artifacts).",
          "propertyNames": { "pattern": "^\\[[A-Z0-9][A-Z0-9 /\\-]*\\]$" },
          "additionalProperties": { "type": ["string", "null"], "minLength": 1 }
        },
        "sections": {
          "type": "array",
          "minItems": 1,
          "items": {
            "type": "object",
            "additionalProperties": false,
            "required": ["title", "blocks"],
            "properties": {
              "title": { "type": "string", "minLength": 1, "description": "Must match the artifact type's sectionSchema title exactly, in order. Engine rejects missing, extra, or reordered sections (ContentValidation)." },
              "descriptorLine": { "type": ["string", "null"], "description": "Optional single italic gray intro line. One maximum per section." },
              "blocks": {
                "type": "array",
                "minItems": 1,
                "items": { "$ref": "#/$defs/contentBlock" }
              }
            }
          }
        },
        "normalizedFindings": { "type": ["array", "null"], "items": { "$ref": "#/$defs/evidenceItem" } },
        "normalizedRisks": { "type": ["array", "null"], "items": { "$ref": "#/$defs/evidenceItem" } },
        "normalizedInventoryEntities": { "type": ["array", "null"], "items": { "$ref": "#/$defs/evidenceItem" } }
      }
    },

    "evidenceReferences": {
      "type": ["object", "null"],
      "additionalProperties": false,
      "properties": {
        "readinessWorkbookRefs": { "type": "array", "items": { "type": "string" } },
        "riskRegisterRefs": { "type": "array", "items": { "type": "string" } },
        "assetInventoryRefs": { "type": "array", "items": { "type": "string" } },
        "approvedNarrativeInputs": { "type": "array", "items": { "type": "string" }, "description": "Identifiers of human-approved free-text inputs. Narrative without an approval reference is not evidence." }
      }
    },

    "dependencies": {
      "type": ["array", "null"],
      "description": "Stable-identifier references, never filename-only strings (Arti-Generator 13.2). blocking=true dependencies that cannot be resolved fail generation or promotion per policy (DependencyResolutionError).",
      "items": {
        "type": "object",
        "additionalProperties": false,
        "required": ["dependencyId", "kind", "blocking"],
        "properties": {
          "dependencyId": { "type": "string", "minLength": 1 },
          "kind": { "type": "string", "enum": ["document", "clause-library", "placeholder-dictionary", "registry-record", "workbook", "other"] },
          "blocking": { "type": "boolean" }
        }
      }
    },

    "renderingOptions": {
      "type": "object",
      "additionalProperties": false,
      "required": ["packageName", "outputFileName"],
      "properties": {
        "packageName": { "type": "string", "minLength": 1, "description": "Footer [PACKAGE] value." },
        "outputFileName": { "type": "string", "pattern": "^ORG - .+ - v[0-9]+\\.[0-9]+\\.docx$" },
        "optionalSectionToggles": { "type": ["object", "null"], "additionalProperties": { "type": "boolean" } },
        "stylingProfile": { "type": "string", "const": "org-v1.2", "default": "org-v1.2", "description": "Pins the style-rules.json version this render must use." }
      }
    },

    "validationPolicy": {
      "type": "object",
      "additionalProperties": false,
      "required": ["mode"],
      "properties": {
        "mode": {
          "type": "string",
          "enum": ["draft", "promotion"],
          "description": "draft: style deviations and unresolved client-completion placeholders downgrade to warnings; controlled-document violations still fail closed. promotion: everything blocks. There is no mode in which a missing or invalid Document Control Header produces output."
        },
        "additionalRequiredCheckIds": { "type": ["array", "null"], "items": { "type": "string" } },
        "warningThreshold": { "type": ["integer", "null"], "minimum": 0, "description": "Optional cap; exceeding it fails the run even in draft mode." }
      }
    }
  },

  "$defs": {
    "contentBlock": {
      "type": "object",
      "additionalProperties": false,
      "required": ["blockType"],
      "properties": {
        "blockType": {
          "type": "string",
          "enum": ["paragraph", "h2", "h3", "table", "radioQuestion", "clauseInsertion", "aggregationTable", "copyReadyMessage", "warnCallout", "bulletList"]
        },
        "text": { "type": ["string", "null"] },
        "internalOnly": { "type": ["boolean", "null"], "description": "Marks a block as an internal-only note (remove-before-client-use). QA-SF-09 fails any internalOnly block in a client-facing artifact at promotion; internally-classified artifacts may retain it, and it renders per its blockType (author internal notes as an already-supported block, e.g. paragraph)." },
        "clauseId": { "type": ["string", "null"], "pattern": "^CL-[0-9]{3}$", "description": "Required when blockType=clauseInsertion. Engine inserts canonical text from clause-library.json and verifies the SHA-256; Governor-supplied clause text is ignored by design so paraphrase drift is structurally impossible." },
        "aggregationSource": { "type": ["string", "null"], "enum": ["clauseLibrary", "placeholderDictionary", null], "description": "For an aggregationTable block: the config source to project. clauseLibrary is live; placeholderDictionary is reserved and fails closed until the PDX slice." },
        "rows": { "type": ["array", "null"], "items": { "type": "array", "items": { "type": "string" } } },
        "columnHeaders": { "type": ["array", "null"], "items": { "type": "string" } },
        "items": { "type": ["array", "null"], "items": { "type": "string" } },
        "question": {
          "type": ["object", "null"],
          "additionalProperties": false,
          "required": ["number", "prompt", "required", "options"],
          "properties": {
            "number": { "type": "integer", "minimum": 1 },
            "prompt": { "type": "string", "minLength": 1 },
            "required": { "type": "boolean" },
            "options": { "type": "array", "minItems": 4, "items": { "type": "string", "minLength": 1 }, "description": "Four-option minimum per the v1.2 radio pattern. Renderer applies U+25CB glyph, indentation, and descriptor line; the Governor supplies only labels." }
          }
        }
      }
    },
    "evidenceItem": {
      "type": "object",
      "additionalProperties": false,
      "required": ["id", "summary"],
      "properties": {
        "id": { "type": "string", "minLength": 1 },
        "summary": { "type": "string", "minLength": 1 },
        "sourceRef": { "type": ["string", "null"] },
        "severity": { "type": ["string", "null"], "enum": ["Critical", "High", "Moderate", "Low", null] }
      }
    }
  }
}
