{
  "schemaVersion": "1.0.0",
  "artifactIdentity": {
    "artifactType": "TAK",
    "documentId": "ORG-TRN-TAK-001",
    "version": "v1.0",
    "classification": "Client-Facing",
    "approvalStatus": "Draft",
    "layer": "Delivery"
  },
  "context": {
    "client": "Talewind CPA",
    "engagement": "Copilot Chat Pilot 2026",
    "owner": "Registry Owner",
    "audience": "Approved users, trainer, administrator",
    "preparedBy": "ORG Consulting, LLC",
    "reviewDate": null,
    "reviewDateOverride": null
  },
  "sourceWorkflowContext": {
    "workflowName": "Copilot Readiness Assessment",
    "phase": "Training",
    "executionId": "GOV-2026-07-11-003"
  },
  "dataInputs": {
    "placeholderMap": {
      "[CLIENT ORGANIZATION NAME]": "Talewind CPA",
      "[TOOL / CONNECTOR NAME]": "Microsoft Copilot Chat",
      "[DATE]": "2026-07-11",
      "[VERSION]": "v1.0"
    },
    "sections": [
      { "title": "Purpose", "descriptorLine": null, "blocks": [
        { "blockType": "paragraph", "text": "This form records your completion of training and your acknowledgment of the required controls for the approved AI tool." }
      ] },
      { "title": "Acknowledgment Statements", "descriptorLine": null, "blocks": [
        { "blockType": "paragraph", "text": "By signing below, you confirm training completion and acknowledge the following governed requirements." },
        { "blockType": "clauseInsertion", "clauseId": "CL-001" },
        { "blockType": "clauseInsertion", "clauseId": "CL-004" },
        { "blockType": "clauseInsertion", "clauseId": "CL-005" },
        { "blockType": "clauseInsertion", "clauseId": "CL-009" }
      ] },
      { "title": "Policy Documents Reviewed", "descriptorLine": null, "blocks": [
        { "blockType": "bulletList", "items": [
          "Acceptable Use Policy",
          "User Quick Reference",
          "Deployment Summary, where distributed to end users"
        ] }
      ] },
      { "title": "Responsibility Statement", "descriptorLine": null, "blocks": [
        { "blockType": "paragraph", "text": "Tool output is a draft. You remain responsible for accuracy, compliance, and all final decisions." }
      ] },
      { "title": "User Acknowledgment and Signature", "descriptorLine": null, "blocks": [
        { "blockType": "paragraph", "text": "User name, signature, title, and date are recorded here, and the administrator or trainer confirms completion." }
      ] }
    ],
    "normalizedFindings": null,
    "normalizedRisks": null,
    "normalizedInventoryEntities": null
  },
  "evidenceReferences": null,
  "dependencies": [
    { "dependencyId": "ORG-MST-SCL", "kind": "clause-library", "blocking": true }
  ],
  "renderingOptions": {
    "packageName": "Governed AI Rollout",
    "outputFileName": "ORG - Training Acknowledgment - Talewind CPA - v1.0.docx",
    "optionalSectionToggles": null,
    "stylingProfile": "org-v1.2"
  },
  "validationPolicy": {
    "mode": "draft",
    "additionalRequiredCheckIds": null,
    "warningThreshold": null
  }
}
